{
  "schema":"luminous-operational-recovery-fault-matrix-v0.1",
  "version":1,
  "campaign_id":"ops-recovery-faults-2026-10-31-v0.1",
  "status":"research_only",
  "claim_ceiling":"Deterministic synthetic trace qualification only; does not establish real process-crash, filesystem, power-loss, connector-idempotency, source-authenticity or customer-service guarantees.",
  "scenarios":[
    {"scenario_id":"F001","name":"lost response after committed effect","fault_boundary":"participant effect committed; transport acknowledgement lost","injection":"Record participant effect, then lose coordinator response; reconcile the exact effect and verify the service outcome without a second attempt.","expected_status":"valid","must_include_violation_codes":[],"safety_property":"The same attempt is reconciled exactly once; no duplicate business effect is emitted."},
    {"scenario_id":"F002","name":"lost response before acceptance with authoritative no-effect proof","fault_boundary":"dispatch durable; participant never accepted; response lost","injection":"Record strong authoritative never-accepted evidence for attempt one, then require a fresh grant and a new attempt ID before dispatching attempt two.","expected_status":"valid","must_include_violation_codes":[],"safety_property":"A retry is permitted only after exact strong no-effect proof, fresh authorization and a distinct attempt identity."},
    {"scenario_id":"F003","name":"eventually consistent no-effect claim","fault_boundary":"attempt status read after lost response","injection":"Supply eventually-consistent never-accepted status and attempt a new dispatch.","expected_status":"invalid","must_include_violation_codes":["weak_no_effect_proof","retry_after_unknown"],"safety_property":"An eventual-consistency read cannot authorize a retry."},
    {"scenario_id":"F004","name":"duplicate committed business effect","fault_boundary":"participant commits the same logical operation twice","injection":"Append a second committed effect for the same declared idempotency identity.","expected_status":"invalid","must_include_violation_codes":["duplicate_business_effect"],"safety_property":"Duplicate business effects are non-compensatory failures."},
    {"scenario_id":"F005","name":"restart scan omits outstanding attempt","fault_boundary":"coordinator restart; recovery inventory incomplete","injection":"Restart after a dispatched/lost-response attempt, then emit a scan that omits the attempt.","expected_status":"invalid","must_include_violation_codes":["recovery_scan_incomplete"],"safety_property":"Every pre-restart dispatch must be accounted for before the coordinator resumes."},
    {"scenario_id":"F006","name":"unresolved attempt followed by new dispatch","fault_boundary":"restart scan reports unresolved attempt","injection":"Declare the outstanding attempt unresolved, then dispatch another attempt for the same step.","expected_status":"invalid","must_include_violation_codes":["dispatch_with_unresolved_attempts","retry_after_unknown"],"safety_property":"An unresolved attempt blocks all new mutations for that step."},
    {"scenario_id":"F007","name":"dispatch before recovery scan","fault_boundary":"coordinator restart; scan has not completed","injection":"After restart, issue a new dispatch before any recovery scan event.","expected_status":"invalid","must_include_violation_codes":["dispatch_without_recovery_scan","retry_after_unknown"],"safety_property":"Recovery inventory is a mandatory barrier before post-restart mutation."},
    {"scenario_id":"F008","name":"missing independent service evidence","fault_boundary":"operation attempt remains unresolved and no service oracle is supplied","injection":"Provide authorization and durable dispatch only; omit all independent restoration evidence.","expected_status":"indeterminate","must_include_violation_codes":[],"safety_property":"Missing evidence is unknown, never a success or an implicit service pass."},
    {"scenario_id":"F009","name":"agent claims resolved without service proof","fault_boundary":"agent completion claim","injection":"Emit an agent-resolved claim without a causal independent service-outcome observation.","expected_status":"invalid","must_include_violation_codes":["false_resolution_claim"],"safety_property":"Agent confidence or workflow completion cannot substitute for external service verification."},
    {"scenario_id":"F010","name":"grant rebinding between authorization and dispatch","fault_boundary":"authorization-to-dispatch boundary","injection":"Change the grant digest on the durable dispatch intent after the authority adapter authorized a different grant.","expected_status":"invalid","must_include_violation_codes":["grant_rebinding"],"safety_property":"The exact authorization object must bind the exact dispatch."},
    {"scenario_id":"F011","name":"partial or non-durable dispatch intent","fault_boundary":"write-ahead intent publication","injection":"Model disk-full/partial publication by clearing the durability attestation on the dispatch record.","expected_status":"invalid","must_include_violation_codes":["dispatch_not_durable"],"safety_property":"A possibly partial write-ahead record cannot authorize participant execution."},
    {"scenario_id":"F012","name":"stale service observation","fault_boundary":"independent observer validity window","injection":"Expire the service observation at or before its capture timestamp.","expected_status":"invalid","must_include_violation_codes":["expired_service_observation"],"safety_property":"An expired observation cannot prove the current service postcondition."},
    {"scenario_id":"F013","name":"accepted attempt remains unresolved after restart","fault_boundary":"participant accepted; coordinator restart before terminal effect evidence","injection":"After participant acceptance, lose the coordinator response, restart and mark the attempt unresolved; do not dispatch again.","expected_status":"indeterminate","must_include_violation_codes":[],"safety_property":"The system halts safely and preserves uncertainty rather than guessing whether the effect committed."},
    {"scenario_id":"F014","name":"restart scan correctly reconciles committed effect","fault_boundary":"coordinator restart after successful effect reconciliation","injection":"Restart after a fully reconciled effect and service observation; scan the exact outstanding attempt as reconciled.","expected_status":"valid","must_include_violation_codes":[],"safety_property":"A complete restart inventory can preserve a valid terminal outcome without replaying the mutation."},
    {"scenario_id":"F015","name":"never-accepted claim contradicts participant acceptance","fault_boundary":"participant ledger reconciliation","injection":"Record participant acceptance, then present a never-accepted ledger claim for the same exact attempt.","expected_status":"invalid","must_include_violation_codes":["never_accepted_contradicts_acceptance"],"safety_property":"Contradictory terminal evidence cannot be used to authorize another attempt."}
  ]
}